{
  "schemaVersion": 1,
  "id": "weekly.week-01",
  "revision": 1,
  "publishedAt": "2026-07-22T16:00:00Z",
  "collection": {
    "id": "weekly.week-01",
    "contentSchemaVersion": 1,
    "title": "This Week's Meals",
    "weekStartDate": "2026-07-20",
    "weekEndDateExclusive": "2026-07-27",
    "entries": [
      {
        "id": "weekly.week-01.chicken-taco-rice-bowls",
        "recipeReference": {
          "recipeID": "weekly.chicken-taco-rice-bowls",
          "contentVersion": 1
        },
        "slot": "lunch",
        "displayOrder": 0,
        "isFeatured": true,
        "promotionalTag": "highProtein"
      },
      {
        "id": "weekly.week-01.protein-overnight-oats",
        "recipeReference": {
          "recipeID": "weekly.protein-overnight-oats",
          "contentVersion": 1
        },
        "slot": "breakfast",
        "displayOrder": 1,
        "isFeatured": false,
        "promotionalTag": "makeAhead"
      },
      {
        "id": "weekly.week-01.make-ahead-breakfast-burritos",
        "recipeReference": {
          "recipeID": "weekly.make-ahead-breakfast-burritos",
          "contentVersion": 1
        },
        "slot": "breakfast",
        "displayOrder": 2,
        "isFeatured": false,
        "promotionalTag": "freezerFriendly"
      },
      {
        "id": "weekly.week-01.korean-ground-beef-bowls",
        "recipeReference": {
          "recipeID": "weekly.korean-ground-beef-bowls",
          "contentVersion": 1
        },
        "slot": "lunch",
        "displayOrder": 3,
        "isFeatured": false,
        "promotionalTag": "reheatsWell"
      },
      {
        "id": "weekly.week-01.honey-garlic-chicken-rice",
        "recipeReference": {
          "recipeID": "weekly.honey-garlic-chicken-rice",
          "contentVersion": 1
        },
        "slot": "dinner",
        "displayOrder": 4,
        "isFeatured": false,
        "promotionalTag": "highProtein"
      },
      {
        "id": "weekly.week-01.one-pot-cheeseburger-pasta",
        "recipeReference": {
          "recipeID": "weekly.one-pot-cheeseburger-pasta",
          "contentVersion": 1
        },
        "slot": "dinner",
        "displayOrder": 5,
        "isFeatured": false,
        "promotionalTag": "easyCleanup"
      },
      {
        "id": "weekly.week-01.protein-berry-smoothie",
        "recipeReference": {
          "recipeID": "weekly.protein-berry-smoothie",
          "contentVersion": 1
        },
        "slot": "snack",
        "displayOrder": 6,
        "isFeatured": false,
        "promotionalTag": "fiveMinutes"
      },
      {
        "id": "weekly.week-01.creamy-buffalo-chicken-dip",
        "recipeReference": {
          "recipeID": "weekly.creamy-buffalo-chicken-dip",
          "contentVersion": 1
        },
        "slot": "snack",
        "displayOrder": 7,
        "isFeatured": false,
        "promotionalTag": "crowdFavorite"
      }
    ],
    "promotionalMessage": "Two breakfasts, two lunches, two dinners, and two snacks—ready to add to your shopping trip."
  },
  "recipes": [
    {
      "id": "weekly.protein-overnight-oats",
      "contentVersion": 1,
      "title": "Protein Overnight Oats",
      "shortDescription": "Creamy overnight oats with Greek yogurt, berries, and protein powder for an easy make-ahead breakfast.",
      "defaultServings": 1,
      "servingDescription": "1 jar",
      "ingredients": [
        {
          "id": "rolled-oats",
          "rawText": "1/2 cup rolled oats",
          "name": "Rolled oats",
          "quantity": 0.5,
          "unit": "cup",
          "preparation": "",
          "category": "pantry",
          "pricingKey": "rolled-oats",
          "isQualitative": false
        },
        {
          "id": "milk",
          "rawText": "1/2 cup milk",
          "name": "Milk",
          "quantity": 0.5,
          "unit": "cup",
          "preparation": "",
          "category": "dairy",
          "pricingKey": "milk",
          "isQualitative": false
        },
        {
          "id": "plain-greek-yogurt",
          "rawText": "1/2 cup plain Greek yogurt",
          "name": "Plain Greek yogurt",
          "quantity": 0.5,
          "unit": "cup",
          "preparation": "",
          "category": "dairy",
          "pricingKey": "plain-greek-yogurt",
          "isQualitative": false
        },
        {
          "id": "vanilla-protein-powder",
          "rawText": "1/2 scoop vanilla protein powder",
          "name": "Vanilla protein powder",
          "quantity": 0.5,
          "unit": "each",
          "preparation": "",
          "category": "pantry",
          "pricingKey": "vanilla-protein-powder-scoop",
          "isQualitative": false
        },
        {
          "id": "chia-seeds",
          "rawText": "1 1/2 teaspoons chia seeds",
          "name": "Chia seeds",
          "quantity": 1.5,
          "unit": "tsp",
          "preparation": "",
          "category": "pantry",
          "pricingKey": "chia-seeds",
          "isQualitative": false
        },
        {
          "id": "mixed-berries",
          "rawText": "1/2 cup mixed berries",
          "name": "Mixed berries",
          "quantity": 0.5,
          "unit": "cup",
          "preparation": "",
          "category": "produce",
          "pricingKey": "mixed-berries",
          "isQualitative": false
        },
        {
          "id": "maple-syrup",
          "rawText": "1 teaspoon maple syrup, optional",
          "name": "Maple syrup",
          "quantity": 1,
          "unit": "tsp",
          "preparation": "",
          "category": "pantry",
          "pricingKey": "maple-syrup",
          "optionalPolicy": "excludedByDefault",
          "isQualitative": false
        },
        {
          "id": "salt",
          "rawText": "Pinch of salt",
          "name": "Salt",
          "quantity": null,
          "unit": "to taste",
          "preparation": "",
          "category": "pantry",
          "pricingKey": null,
          "isQualitative": true
        }
      ],
      "instructions": [
        {
          "id": 1,
          "text": "Add the oats, milk, Greek yogurt, protein powder, chia seeds, and salt to a jar or container."
        },
        {
          "id": 2,
          "text": "Stir until no dry protein-powder pockets remain."
        },
        {
          "id": 3,
          "text": "Fold in or top with the berries."
        },
        {
          "id": 4,
          "text": "Cover and refrigerate overnight."
        },
        {
          "id": 5,
          "text": "Add maple syrup when serving if desired."
        }
      ],
      "substitutions": [
        {
          "id": "gluten-free-oats",
          "ingredientID": "rolled-oats",
          "replacementName": "Certified gluten-free rolled oats",
          "note": "Supports a gluten-free option only when all packaged ingredients are verified."
        }
      ],
      "metadata": {
        "prepMinutes": 5,
        "cookMinutes": 0,
        "passiveMinutes": 480,
        "nutrition": {
          "caloriesPerServing": 350,
          "calorieRangeMinimum": 325,
          "calorieRangeMaximum": 425,
          "proteinGramsPerServing": 30,
          "servingDefinition": "1 jar",
          "verificationStatus": "editorialEstimate",
          "nutritionVersion": 1
        },
        "costEstimate": {
          "recipeID": "weekly.protein-overnight-oats",
          "recipeContentVersion": 1,
          "servingDefinition": "1 jar",
          "totalRecipeCost": null,
          "costPerServing": null,
          "costRangeMinimumPerServing": null,
          "costRangeMaximumPerServing": null,
          "currencyCode": "USD",
          "basis": "proportionalIngredientValue",
          "status": "requiresVerification",
          "pricingRegion": "US",
          "priceSnapshotDate": null,
          "pricingVersion": 1,
          "includedIngredientIDs": [],
          "excludedIngredientIDs": [],
          "notes": "Reviewed production pricing inputs are pending."
        },
        "mealTypes": [
          "breakfast"
        ],
        "verifiedDietaryClaims": [
          {
            "claim": "glutenFree",
            "applicability": "withDocumentedSubstitution",
            "verificationVersion": 1
          }
        ],
        "merchandisingTags": [
          "makeAhead",
          "highProtein"
        ],
        "imageAssetName": "weekly-placeholder-protein-overnight-oats",
        "accessibilityDescription": "A jar of creamy overnight oats with berries.",
        "isMealPrepFriendly": true,
        "isFeaturedEligible": true
      }
    },
    {
      "id": "weekly.honey-garlic-chicken-rice",
      "contentVersion": 1,
      "title": "Honey Garlic Chicken and Rice",
      "shortDescription": "Tender chicken and broccoli with a familiar honey-garlic sauce served over rice.",
      "defaultServings": 4,
      "servingDescription": "1 plated serving",
      "ingredients": [
        {
          "id": "chicken-breast",
          "rawText": "1 1/2 pounds boneless skinless chicken breast",
          "name": "Boneless skinless chicken breast",
          "quantity": 1.5,
          "unit": "lb",
          "preparation": "",
          "category": "meat",
          "pricingKey": "boneless-skinless-chicken-breast",
          "isQualitative": false
        },
        {
          "id": "cooked-rice",
          "rawText": "3 cups cooked rice",
          "name": "Cooked rice",
          "quantity": 3,
          "unit": "cup",
          "preparation": "",
          "category": "pantry",
          "pricingKey": "cooked-rice",
          "isQualitative": false
        },
        {
          "id": "broccoli",
          "rawText": "4 cups broccoli florets",
          "name": "Broccoli florets",
          "quantity": 4,
          "unit": "cup",
          "preparation": "",
          "category": "produce",
          "pricingKey": "broccoli-florets",
          "isQualitative": false
        },
        {
          "id": "honey",